<?xml version="1.0" encoding="UTF-8"?>
<!DOCTYPE classroom SYSTEM "classroom.dtd">
<classroom cid="c1">
	<cname>职专</cname>
	<cgrade>2012</cgrade>
	<sutdents>
		<student>
			<sid></sid>
			<sname></sname>
			<age>12</age>
		</student>
	</sutdents>
</classroom>